{
  "type": "measure_spec",
  "measure_id": "gad7",
  "version": "1.0.0",
  "name": "Generalized Anxiety Disorder-7",
  "kind": "questionnaire",
  "locale": "en-US",
  "aliases": ["GAD-7", "GAD7", "GAD 7"],
  "description": "A 7-item anxiety screening tool plus severity assessment",
  "items": [
    {
      "item_id": "gad7_item1",
      "position": 1,
      "text": "Feeling nervous, anxious, or on edge",
      "response_map": {
        "not at all": 0,
        "several days": 1,
        "more than half the days": 2,
        "nearly every day": 3
      },
      "aliases": {
        "never": "not at all",
        "more than half of the days": "more than half the days"
      }
    },
    {
      "item_id": "gad7_item2",
      "position": 2,
      "text": "Not being able to stop or control worrying",
      "response_map": {
        "not at all": 0,
        "several days": 1,
        "more than half the days": 2,
        "nearly every day": 3
      },
      "aliases": {
        "never": "not at all",
        "more than half of the days": "more than half the days"
      }
    },
    {
      "item_id": "gad7_item3",
      "position": 3,
      "text": "Worrying too much about different things",
      "response_map": {
        "not at all": 0,
        "several days": 1,
        "more than half the days": 2,
        "nearly every day": 3
      },
      "aliases": {
        "never": "not at all",
        "more than half of the days": "more than half the days"
      }
    },
    {
      "item_id": "gad7_item4",
      "position": 4,
      "text": "Trouble relaxing",
      "response_map": {
        "not at all": 0,
        "several days": 1,
        "more than half the days": 2,
        "nearly every day": 3
      },
      "aliases": {
        "never": "not at all",
        "more than half of the days": "more than half the days"
      }
    },
    {
      "item_id": "gad7_item5",
      "position": 5,
      "text": "Being so restless that it's hard to sit still",
      "response_map": {
        "not at all": 0,
        "several days": 1,
        "more than half the days": 2,
        "nearly every day": 3
      },
      "aliases": {
        "never": "not at all",
        "more than half of the days": "more than half the days"
      }
    },
    {
      "item_id": "gad7_item6",
      "position": 6,
      "text": "Becoming easily annoyed or irritable",
      "response_map": {
        "not at all": 0,
        "several days": 1,
        "more than half the days": 2,
        "nearly every day": 3
      },
      "aliases": {
        "never": "not at all",
        "more than half of the days": "more than half the days"
      }
    },
    {
      "item_id": "gad7_item7",
      "position": 7,
      "text": "Feeling afraid as if something awful might happen",
      "response_map": {
        "not at all": 0,
        "several days": 1,
        "more than half the days": 2,
        "nearly every day": 3
      },
      "aliases": {
        "never": "not at all",
        "more than half of the days": "more than half the days"
      }
    },
    {
      "item_id": "gad7_item8",
      "position": 8,
      "text": "If you checked off any problems, how difficult have these problems made it for you to do your work, take care of things at home, or get along with other people?",
      "response_map": {
        "not difficult at all": 0,
        "somewhat difficult": 1,
        "very difficult": 2,
        "extremely difficult": 3
      },
      "aliases": {
        "not at all difficult": "not difficult at all"
      }
    }
  ],
  "scales": [
    {
      "scale_id": "gad7_total",
      "name": "GAD-7 Total Score",
      "items": ["gad7_item1", "gad7_item2", "gad7_item3", "gad7_item4", "gad7_item5", "gad7_item6", "gad7_item7"],
      "method": "sum",
      "reversed_items": [],
      "min": 0,
      "max": 21,
      "missing_allowed": 1,
      "missing_strategy": "prorate",
      "interpretations": [
        { "min": 0, "max": 4, "label": "Minimal" },
        { "min": 5, "max": 9, "label": "Mild" },
        { "min": 10, "max": 14, "label": "Moderate" },
        { "min": 15, "max": 21, "label": "Severe" }
      ]
    },
    {
      "scale_id": "gad7_severity",
      "name": "GAD-7 Functional Severity",
      "items": ["gad7_item8"],
      "method": "sum",
      "reversed_items": [],
      "min": 0,
      "max": 3,
      "missing_allowed": 0,
      "interpretations": [
        { "min": 0, "max": 0, "label": "Not difficult at all" },
        { "min": 1, "max": 1, "label": "Somewhat difficult" },
        { "min": 2, "max": 2, "label": "Very difficult" },
        { "min": 3, "max": 3, "label": "Extremely difficult" }
      ]
    }
  ]
}
